{
  "schemaVersion": "bottleneck-analysis/0.1",
  "analysisVersion": "causal-study/0.1",
  "stateHashVersion": "snapshot-canonical-v1",
  "solverHash": "5F94199205C63A4283021CA57DB40192697DFA04A3BBC7D2D96CC4284FC87A43",
  "referenceHash": "FD61D98A9DF227DCF4E5A1166CC637D3690E9C096C74B6A211009D18DC7C65EE",
  "analysisAssemblyHash": "B9DAF24899263264CF6945766434E4A6EF77DF1F290A095E12D639B0FBDE3A02",
  "records": [
    {
      "schemaVersion": "bottleneck-analysis/0.1",
      "recordId": "Level00115-lower-right",
      "levelHash": "4BCCC3F06B93AC953D3505A83CD16383AFD60542DE8D8FACEC82291A7E6ED1B8",
      "catalogHash": "C842DAE3978EACB318399DCE65E1CE34CDDBB4859E52C043CCE0A43A50EAFC93",
      "analysisVersion": "causal-study/0.1",
      "startStateHash": "E1007BB6C3C8FFAF476D7C684CD270D1E3F593DC39362C8EBBA378C3C74E947F",
      "goalPredicateVersion": "classic-goals/0.1",
      "blockedTasks": [
        "h2 lower-right board sources then b2 mouth"
      ],
      "affectedActors": [
        0,
        1,
        2,
        3,
        4,
        5,
        6,
        7
      ],
      "constraints": [
        {
          "id": "queue-order",
          "type": "QueueOrder",
          "statement": "Ordered consumption",
          "evidenceRefs": [
            "queue-rule"
          ]
        },
        {
          "id": "parking",
          "type": "Parking",
          "statement": "Useful footprint routing and staging",
          "evidenceRefs": [
            "geometry"
          ]
        }
      ],
      "supportTasks": [
        {
          "taskId": "Q115-B-endpoint-freeze-h0",
          "actor": 0,
          "necessityStatus": "ScopedSearchNecessary",
          "reason": "Removing this actor's one fixed endpoint action eliminates all declared schedules; not global necessity",
          "evidenceRef": "Q115-B-endpoint-freeze-h0"
        },
        {
          "taskId": "Q115-B-endpoint-freeze-h7",
          "actor": 7,
          "necessityStatus": "ScopedSearchNecessary",
          "reason": "Removing this actor's one fixed endpoint action eliminates all declared schedules; not global necessity",
          "evidenceRef": "Q115-B-endpoint-freeze-h7"
        },
        {
          "taskId": "Q115-B-endpoint-freeze-h2",
          "actor": 2,
          "necessityStatus": "ScopedSearchNecessary",
          "reason": "Removing this actor's one fixed endpoint action eliminates all declared schedules; not global necessity",
          "evidenceRef": "Q115-B-endpoint-freeze-h2"
        },
        {
          "taskId": "Q115-B-endpoint-freeze-h3",
          "actor": 3,
          "necessityStatus": "ScopedSearchNecessary",
          "reason": "Removing this actor's one fixed endpoint action eliminates all declared schedules; not global necessity",
          "evidenceRef": "Q115-B-endpoint-freeze-h3"
        },
        {
          "taskId": "Q115-B-endpoint-freeze-h5",
          "actor": 5,
          "necessityStatus": "ScopedSearchNecessary",
          "reason": "Removing this actor's one fixed endpoint action eliminates all declared schedules; not global necessity",
          "evidenceRef": "Q115-B-endpoint-freeze-h5"
        }
      ],
      "alternatives": [
        {
          "strategySignature": "clear-h4",
          "eventType": "Clear",
          "witnessPlanHash": "92A75AB86748061DC9A2C4D2CA6477205413F46748B8AD72B43B5A0B8B2FADAD",
          "startStateHash": "E1007BB6C3C8FFAF476D7C684CD270D1E3F593DC39362C8EBBA378C3C74E947F",
          "endStateHash": "88B4578DE999B840E3C74E051A728538954A4841C40C338EF73404EB736C299B",
          "searchResultRef": "existing-witness",
          "replayStatus": "IndependentSolved",
          "signatureVersion": "witness-style/0.1"
        },
        {
          "strategySignature": "park-live-h4",
          "eventType": "Reposition",
          "witnessPlanHash": "5D8FF5AEF9980F7DDFBB324A3B9F0CACFADE3892AF8E202CAE13DA3078E4205E",
          "startStateHash": "E1007BB6C3C8FFAF476D7C684CD270D1E3F593DC39362C8EBBA378C3C74E947F",
          "endStateHash": "9975D2BE25DAC13BA4F7E0F8AA91EA4A42F8EF0AE1C6136C6430B47409DD3D80",
          "searchResultRef": "existing-witness",
          "replayStatus": "IndependentSolved",
          "signatureVersion": "witness-style/0.1"
        }
      ],
      "relief": {
        "diagnostic": "footprint-shadow and relocation plus continuation",
        "continuation": "h2 consumes remaining sources; h7/h3/h1 use b2",
        "sameRemainingTaskCheck": "Fresh state-local footprint-shadow checks in cases[].reliefChecks",
        "residualTasks": [
          "Unknown global residual bottleneck attribution; inspect other branch/queue and parking tasks"
        ],
        "cleanupTasks": [
          "Unknown global cleanup boundary; direct tail is witness-specific"
        ]
      },
      "evidence": [
        {
          "id": "queue-rule",
          "class": "RuleNecessary",
          "statement": "Consume queue entries in order; completion not required for queue advance",
          "artifact": "Levels/Level00115.json",
          "scope": "single-layer ordinary queue",
          "limitations": "Does not establish completion dependencies"
        },
        {
          "id": "replayed-witnesses",
          "class": "ObservedWitness",
          "statement": "Two complete plans independently replay to win; live queue visits recorded",
          "artifact": "causal-study.json#cases",
          "scope": "two solver modes of this input",
          "limitations": "No optimum, necessity or uniqueness claim"
        },
        {
          "id": "geometry",
          "class": "LocalDiagnostic",
          "statement": "Clear or reposition h4 unlocks h2 lower-right targets",
          "artifact": "access-focus-*.json",
          "scope": "state-local or structural only",
          "limitations": "Actor graph cycles do not prove cognitive difficulty"
        },
        {
          "id": "Q115-B-endpoint-freeze-h0",
          "class": "ScopedSearchNecessary",
          "statement": "Fixed endpoint schedule has no solution after excluding this actor",
          "artifact": "causal-study.json#searches",
          "scope": "all ordered subsets of actor/endpoints: h2:(4,5);h3:(3,6);h4:(0,3);h5:(1,5);h7:(1,0)",
          "limitations": "Only this start snapshot and one move per declared actor to fixed anchors; other parking or repeated moves untested"
        },
        {
          "id": "Q115-B-endpoint-freeze-h7",
          "class": "ScopedSearchNecessary",
          "statement": "Fixed endpoint schedule has no solution after excluding this actor",
          "artifact": "causal-study.json#searches",
          "scope": "all ordered subsets of actor/endpoints: h0:(0,0);h2:(4,5);h3:(3,6);h4:(0,3);h5:(1,5)",
          "limitations": "Only this start snapshot and one move per declared actor to fixed anchors; other parking or repeated moves untested"
        },
        {
          "id": "Q115-B-endpoint-freeze-h2",
          "class": "ScopedSearchNecessary",
          "statement": "Fixed endpoint schedule has no solution after excluding this actor",
          "artifact": "causal-study.json#searches",
          "scope": "all ordered subsets of actor/endpoints: h0:(0,0);h3:(3,6);h4:(0,3);h5:(1,5);h7:(1,0)",
          "limitations": "Only this start snapshot and one move per declared actor to fixed anchors; other parking or repeated moves untested"
        },
        {
          "id": "Q115-B-endpoint-freeze-h3",
          "class": "ScopedSearchNecessary",
          "statement": "Fixed endpoint schedule has no solution after excluding this actor",
          "artifact": "causal-study.json#searches",
          "scope": "all ordered subsets of actor/endpoints: h0:(0,0);h2:(4,5);h4:(0,3);h5:(1,5);h7:(1,0)",
          "limitations": "Only this start snapshot and one move per declared actor to fixed anchors; other parking or repeated moves untested"
        },
        {
          "id": "Q115-B-endpoint-freeze-h5",
          "class": "ScopedSearchNecessary",
          "statement": "Fixed endpoint schedule has no solution after excluding this actor",
          "artifact": "causal-study.json#searches",
          "scope": "all ordered subsets of actor/endpoints: h0:(0,0);h2:(4,5);h3:(3,6);h4:(0,3);h7:(1,0)",
          "limitations": "Only this start snapshot and one move per declared actor to fixed anchors; other parking or repeated moves untested"
        }
      ],
      "unknowns": [
        "Minimal reasoning/lookahead Unknown",
        "Global main bottleneck Unknown",
        "DifficultyScore Unrated",
        "Human fairness and queue visibility unverified"
      ]
    },
    {
      "schemaVersion": "bottleneck-analysis/0.1",
      "recordId": "Level00115-b3-release",
      "levelHash": "4BCCC3F06B93AC953D3505A83CD16383AFD60542DE8D8FACEC82291A7E6ED1B8",
      "catalogHash": "C842DAE3978EACB318399DCE65E1CE34CDDBB4859E52C043CCE0A43A50EAFC93",
      "analysisVersion": "causal-study/0.1",
      "startStateHash": "E1007BB6C3C8FFAF476D7C684CD270D1E3F593DC39362C8EBBA378C3C74E947F",
      "goalPredicateVersion": "classic-goals/0.1",
      "blockedTasks": [
        "Expose b3 color6 and make mouth usable by h0"
      ],
      "affectedActors": [
        6,
        0
      ],
      "constraints": [
        {
          "id": "queue-order",
          "type": "QueueOrder",
          "statement": "Ordered consumption",
          "evidenceRefs": [
            "queue-rule"
          ]
        },
        {
          "id": "parking",
          "type": "Parking",
          "statement": "Useful footprint routing and staging",
          "evidenceRefs": [
            "geometry"
          ]
        }
      ],
      "supportTasks": [
        {
          "taskId": "b3-earlier-support",
          "necessityStatus": "Unknown",
          "reason": "No global attribution of prefix to this branch"
        }
      ],
      "alternatives": [
        {
          "strategySignature": "consume-b3-head-and-clear-h6",